index,pdf_file,text,topics,year,author,clusterID,citations,type,abstract,globalID,tags,user,words,pages,abstract_bert_vector,citationsList,versions,url,notes,title,bert_vector,parent_item,conclusion_bert_vector,organization,citationArticles,vec_2d,abstract_2d,conclusion_2d
three noteworthy limitations to this study include the small number
of participants, the single document set used, and the short task time
duration. first, it is possible that we could have discovered stronger
signiﬁcance levels and more signiﬁcant results with additional par-
ticipants, reducing some of the variance in the participant scores
and behaviors. additionally, using only the blue iguanodon set of
documents in this study limits the generalizability of our ﬁndings.
this is due to the large amount of noise in the document set (since
many documents are irrelevant to the main plot), as well as the short
average length of these documents. it is certainly possible that these
ﬁndings could differ with a collection of longer documents. finally,
while supporting longer-term sensemaking sessions is certainly a
goal of this work, the current study focuses on short two hour ses-
sions. it would be interesting to see the value of sif functionality in
multi-day scenarios.

an additional consideration in the study design is that, while the
ksf group did not have the advantage of sif, they did have other
advantages associated with semantic interaction and the user interest
model, such as automatic highlighting, relevance-based node sizing,
etc. most ksf-only systems would likely not include these features.
thus, the actual difference between the experimental condition and
the control condition in this study was perhaps smaller than it would
be in a realistic setting. the results found in this study might actually
be ampliﬁed when comparing sif to traditional ksf approaches.

7 conclusions and future work
we conducted a comparative user study with starspire to examine
the impact of sif on the sensemaking process. the study showed
that foraging performance was similar between conditions. however,
the group afforded with sif functionality performed signiﬁcantly
more synthesis-related semantic interactions. they externalized
more information (a process associated with synthesis) and injected
more feedback into the underlying user interest model. the system
was then able to forage and identify a broader set of relevant infor-
mation in the spatial workspace. this led to improved sensemaking
task performance, for foraging large textual information and syn-
thesizing a coherent and complete hypothesis narrative, as scored
against a known ground-truth solution. participants in the sif+ksf
condition retrieved 26% of their total relevant documents through
sif on average. executing traditional keyword searches retrieved
the remaining 74% of relevant documents. sif and ksf proved to
be effective complementary retrieval techniques.

based on this user study, participants were able to solve a portion
of the given sensemaking task while retrieving and reading only a
small portion of the overall dataset. however, there was not a clear
superior analytical strategy, which demonstrates that starspire
supports multiple avenues for sensemaking. we also identiﬁed
potential improvements for starspire and its underlying layout
and relevance models that inform the design of future semantic
interaction systems. the automatic text highlighting and node size
relevance encoding, both features enabled by semantic interactions
that learn a user interest model, were especially appreciated by users.
we intend to implement the identiﬁed changes, including altering
the relevance model to include novel documents in addition to the
documents that most closely match the current user interest model.
after these proposed changes are made, we plan to conduct a longi-
tudinal study to observe long-term usage of starspire on real-world
data. example tasks include conducting an in-depth literature review
and learning about a current event in the news.

acknowledgments
this research was supported by nsf grants iis-1218346 and iis-
1447416. the authors would like to recognize the role of comments
from reviewers and discussions with infovis lab @ vt research
group members in improving this work.

references

[1] j. abello, f. v. ham, and n. krishnan. ask-graphview: a large scale
graph visualization system. ieee transactions on visualization and
computer graphics, 12(5):669–676, sept 2006. doi: 10.1109/tvcg.
2006.120

[2] j.-w. ahn and p. brusilovsky. adaptive visualization for exploratory
information processing & management,

information retrieval.
49(5):1139–1164, 2013. doi: 10.1016/j.ipm.2013.01.007

[3] j.-w. ahn, p. brusilovsky, d. he, j. grady, and q. li. personalized web
exploration with task models. in proceedings of the 17th international
conference on world wide web, www ’08, pp. 1–10. acm, new
york, ny, usa, 2008. doi: 10.1145/1367497.1367499

[4] j. alsakran, y. chen, y. zhao, j. yang, and d. luo. streamit: dynamic
visualization and interactive exploration of text streams. in 2011 ieee
paciﬁc visualization symposium, pp. 131–138, march 2011. doi: 10.
1109/pacificvis.2011.5742382

[5] c. andrews, a. endert, and c. north. space to think: large high-
resolution displays for sensemaking. in proceedings of the sigchi
conference on human factors in computing systems, chi ’10, pp.
55–64. acm, new york, ny, usa, 2010. doi: 10.1145/1753326.
1753336

[6] c. andrews and c. north. analyst’s workspace: an embodied sense-
making environment for large, high-resolution displays. in 2012 ieee
conference on visual analytics science and technology (vast), pp.
123–131, oct 2012. doi: 10.1109/vast.2012.6400559

[7] c. andrews and c. north. the impact of physical navigation on spatial
organization for sensemaking. ieee transactions on visualization
and computer graphics, 19(12):2207–2216, dec 2013. doi: 10.1109/
tvcg.2013.205

[8] m. q. w. baldonado and t. winograd. sensemaker: an information-
exploration interface supporting the contextual evolution of a user’s
interests. in proceedings of the acm sigchi conference on human
factors in computing systems, chi ’97, pp. 11–18. acm, new york,
ny, usa, 1997. doi: 10.1145/258549.258563

[9] b. baldwin and b. carpenter. lingpipe. available from world wide

web: http://alias-i.com/lingpipe, 2003.

[10] e. a. bier, s. k. card, and j. w. bodnar. entity-based collaboration
tools for intelligence analysis. in 2008 ieee symposium on visual
analytics science and technology, pp. 99–106, oct 2008. doi: 10.
1109/vast.2008.4677362

[11] l. bradel, a. endert, k. koch, c. andrews, and c. north. large high
resolution displays for co-located collaborative sensemaking: display
usage and territoriality. international journal of human-computer
studies, 71(11):1078–1088, 2013. doi: 10.1016/j.ijhcs.2013.07.004

[12] l. bradel, c. north, l. house, and s. leman. multi-model semantic
in 2014 ieee conference on visual
interaction for text analytics.
analytics science and technology (vast), pp. 163–172, oct 2014. doi:
10.1109/vast.2014.7042492

[13] l. bradel, j. z. self, a. endert, m. s. hossain, c. north, and n. ra-
makrishnan. how analysts cognitively “connect the dots”. in 2013
ieee international conference on intelligence and security informat-
ics, pp. 24–26, june 2013. doi: 10.1109/isi.2013.6578780

[14] e. t. brown, j. liu, c. e. brodley, and r. chang. dis-function:
learning distance functions interactively. in 2012 ieee conference on
visual analytics science and technology (vast), pp. 83–92, oct 2012.
doi: 10.1109/vast.2012.6400486

[15] p. brusilovski, a. kobsa, and w. nejdl. the adaptive web: methods
and strategies of web personalization. springer science & business
media, 2007.

[16] g. chin, jr., o. a. kuchar, and k. e. wolf. exploring the analytical
in proceedings of the sigchi
processes of intelligence analysts.
conference on human factors in computing systems, chi ’09, pp.
11–20. acm, new york, ny, usa, 2009. doi: 10.1145/1518701.
1518704

[17] a. endert, l. bradel, and c. north. beyond control panels: direct
manipulation for visual analytics. ieee computer graphics and ap-
plications, 33(4):6–13, july 2013. doi: 10.1109/mcg.2013.53

[18] a. endert, l. bradel, j. zeitz, c. andrews, and c. north. designing
large high-resolution display workspaces. in proceedings of the inter-

national working conference on advanced visual interfaces, avi ’12,
pp. 58–65. acm, new york, ny, usa, 2012. doi: 10.1145/2254556.
2254570

[19] a. endert, r. burtner, n. cramer, r. perko, s. hampton, and k. cook.
typograph: multiscale spatial exploration of text documents. in 2013
ieee international conference on big data, pp. 17–24, oct 2013. doi:
10.1109/bigdata.2013.6691709

[20] a. endert, p. fiaux, and c. north. semantic interaction for sensemak-
ing: inferring analytical reasoning for model steering. ieee trans-
actions on visualization and computer graphics, 18(12):2879–2888,
dec 2012. doi: 10.1109/tvcg.2012.260

[21] a. endert, s. fox, d. maiti, s. leman, and c. north. the semantics of
clustering: analysis of user-generated spatializations of text documents.
in proceedings of the international working conference on advanced
visual interfaces, avi ’12, pp. 555–562. acm, new york, ny, usa,
2012. doi: 10.1145/2254556.2254660

[22] a. endert, c. han, d. maiti, l. house, s. leman, and c. north.
observation-level interaction with statistical models for visual ana-
in 2011 ieee conference on visual analytics science and
lytics.
technology (vast), pp. 121–130, oct 2011. doi: 10.1109/vast.2011.
6102449

[23] p. fiaux, m. sun, l. bradel, c. north, n. ramakrishnan, and a. endert.
bixplorer: visual analytics with biclusters. computer, 46(8):90–94,
august 2013. doi: 10.1109/mc.2013.269

[24] a. ghias, j. logan, d. chamberlin, and b. c. smith. query by hum-
in pro-
ming: musical information retrieval in an audio database.
ceedings of the third acm international conference on multimedia,
multimedia ’95, pp. 231–236. acm, new york, ny, usa, 1995.
doi: 10.1145/217279.215273

[25] c. gormley and z. tong. elasticsearch: the deﬁnitive guide. o’reilly

media, inc., 1st ed., 2015.

[26] t. m. green, w. ribarsky, and b. fisher. building and applying a
human cognition model for visual analytics. information visualization,
8(1):1–13, 2009. doi: 10.1057/ivs.2008.28

[27] a. gupta and r. jain. visual information retrieval. commun. acm,

40(5):70–79, may 1997. doi: 10.1145/253769.253798

[28] m. a. hearst. tilebars: visualization of term distribution information
in full text information access. in proceedings of the sigchi confer-
ence on human factors in computing systems, chi ’95, pp. 59–66.
acm press/addison-wesley publishing co., new york, ny, usa,
1995. doi: 10.1145/223904.223912

[29] j. heer and d. boyd. vizster: visualizing online social networks. in
ieee symposium on information visualization, pp. 32–39, oct 2005.
doi: 10.1109/infvis.2005.1532126

[30] y. kang, c. gorg, and j. stasko. how can visual analytics assist
investigative analysis? design implications from an evaluation. ieee
transactions on visualization and computer graphics, 17(5):570–583,
may 2011. doi: 10.1109/tvcg.2010.84

[31] x. lin, d. soergel, and g. marchionini. a self-organizing semantic
in proceedings of the 14th annual
map for information retrieval.
international acm sigir conference on research and development
in information retrieval, sigir ’91, pp. 262–269. acm, new york,
ny, usa, 1991. doi: 10.1145/122860.122887

[32] k. logan. spatial history: using spatial memory to recall informa-

tion. phd thesis, virginia tech, 2012.

[33] a. mack and i. rock. inattentional blindness, vol. 33. mit press

cambridge, ma, 1998.

[34] k. a. olsen, r. r. korfhage, k. m. sochats, m. b. spring, and j. g.
williams. visualization of a document collection: the vibe system.
information processing & management, 29(1):69–81, 1993. doi: 10.
1016/0306-4573(93)90024-8

[35] p. pirolli and s. card. the sensemaking process and leverage points
for analyst technology as identiﬁed through cognitive task analysis. in
proceedings of international conference on intelligence analysis, vol. 5,
2005.

[36] c. plaisant, g. grinstein, j. scholtz, m. whiting, t. o’connell,
s. laskowski, l. chien, a. tat, w. wright, c. grg, z. liu, n. parekh,
k. singhal, and j. stasko. evaluating visual analytics at the 2007
vast symposium contest. ieee computer graphics and applications,
28(2):12–21, march 2008. doi: 10.1109/mcg.2008.27

[37] pnnl. in-spire visual document analysis, 2010.
[38] f. ricci, l. rokach, and b. shapira. introduction to recommender
in recommender systems handbook, pp. 1–35.

systems handbook.
springer, 2011.

[39] t. ruotsalo, j. peltonen, m. eugster, d. głowacka, k. konyushkova,
k. athukorala, i. kosunen, a. reijonen, p. myllym¨aki, g. jacucci,
and s. kaski. directing exploratory search with interactive intent
modeling. in proceedings of the 22nd acm international conference
on information & knowledge management, cikm ’13, pp. 1759–1764.
acm, new york, ny, usa, 2013. doi: 10.1145/2505515.2505644

[40] d. p. russ burtner, shawn bohn. interactive visual comparison of
multimedia data through type-speciﬁc views, 2013. doi: 10.1117/12.
2004735

[41] j. z. self, r. vinayagam, j. t. fry, and c. north. bridging the gap
between user intention and model parameters for data analytics. in sig-
mod 2016 workshop on human-in-the-loop data analytics (hilda
2016), p. 6, june 2016.

[42] s. s. shapiro and m. b. wilk. an analysis of variance test for normality

(complete samples). biometrika, 52(3/4):591–611, 1965.

[43] f. m. shipman and c. c. marshall. formality considered harmful:
experiences, emerging themes, and directions on the use of formal rep-
resentations in interactive systems. computer supported cooperative
work (cscw), 8(4):333–352, 1999. doi: 10.1023/a:1008716330212
[44] j. teevan, s. t. dumais, and e. horvitz. personalizing search via
automated analysis of interests and activities. in proceedings of the
28th annual international acm sigir conference on research and
development in information retrieval, sigir ’05, pp. 449–456. acm,
new york, ny, usa, 2005. doi: 10.1145/1076034.1076111

[45] a. m. treisman and g. gelade. a feature-integration theory of atten-
tion. cognitive psychology, 12(1):97 – 136, 1980. doi: 10.1016/0010
-0285(80)90005-5

[46] k. vogt, l. bradel, c. andrews, c. north, a. endert, and d. hutchings.
co-located collaborative sensemaking on a large high-resolution
display with multiple input devices, pp. 589–604. springer berlin
heidelberg, berlin, heidelberg, 2011. doi: 10.1007/978-3-642-23771
-3 44

[47] j. wenskovitch and c. north. observation-level interaction with clus-
in proceedings of the
tering and dimension reduction algorithms.
2nd workshop on human-in-the-loop data analytics, hilda’17, pp.
14:1–14:6. acm, new york, ny, usa, 2017. doi: 10.1145/3077257.
3077259

[48] j. a. wise, j. j. thomas, k. pennock, d. lantrip, m. pottier, a. schur,
and v. crow. visualizing the non-visual: spatial analysis and interaction
with information from text documents. in proceedings of visualization
1995 conference, pp. 51–58, oct 1995. doi: 10.1109/infvis.1995.
528686

[49] j. m. wolfe and t. s. horowitz. five factors that guide attention in

visual search. nature human behaviour, 1(3):0058, 2017.

[50] j. m. wolfe and m. j. v. wert. varying target prevalence reveals
two dissociable decision criteria in visual search. current biology,
20(2):121 – 124, 2010. doi: 10.1016/j.cub.2009.11.066

[51] p. c. wong, e. g. hetzler, c. posse, m. a. whiting, s. havre,
n. cramer, a. r. shah, m. singhal, a. turner, and j. thomas. in-spire
infovis 2004 contest entry. in infovis, vol. 4, pp. 51–52, 2004.

[52] w. wright, d. schroh, p. proulx, a. skaburskis, and b. cort. the
sandbox for analysis: concepts and methods. in proceedings of the
sigchi conference on human factors in computing systems, chi
’06, pp. 801–810. acm, new york, ny, usa, 2006. doi: 10.1145/
1124772.1124890

[53] j. s. yi, r. melton, j. stasko, and j. a. jacko. dust & magnet: multi-
variate information visualization using a magnet metaphor. information
visualization, 4(4):239–256, 2005. doi: 10.1057/palgrave.ivs.9500099

