index,pdf_file,text,topics,year,author,clusterID,citations,type,abstract,globalID,tags,user,words,pages,abstract_bert_vector,citationsList,versions,url,notes,title,bert_vector,parent_item,conclusion_bert_vector,organization,citationArticles,vec_2d,abstract_2d,conclusion_2d
7YWBXAWZ,N6NB5V6C,"volume xx (200y), number z, pp. 1–29

8
1
0
2

 

b
e
f
2
2

 

 
 
]
l
m

.
t
a
t
s
[
 
 

1
v
4
5
9
7
0

.

2
0
8
1
:
v
i
x
r
a

the state of the art in

integrating machine learning into visual analytics

a. endert1, w. ribarsky2, c. turkay3, w. wong4, i. nabney5, i. d´ıaz blanco6, f. rossi7

1georgia tech, usa

2university of north carolina, charlotte, usa

3city university of london, uk

4middlesex university, uk

5aston university, uk

6university of oviedo, spain

7paris 1 panth´eon sorbonne university, paris

abstract
visual analytics systems combine machine learning or other analytic techniques with interactive data visualization
to promote sensemaking and analytical reasoning. it is through such techniques that people can make sense of large,
complex data. while progress has been made, the tactful combination of machine learning and data visualization
is still under-explored. this state-of-the-art report presents a summary of the progress that has been made by
highlighting and synthesizing select research advances. further, it presents opportunities and challenges to enhance
the synergy between machine learning and visual analytics for impactful future research directions.

categories and subject descriptors (according to acm ccs): human-centered computing - visualization, visual
analytics

1. introduction

we are in a data-driven era. increasingly more domains
generate and consume data. people have the potential to un-
derstand phenomena in more depth using new data analysis
techniques. additionally, new phenomena can be uncovered
in domains where data is becoming available. thus, making
sense of data is becoming increasingly important, and this is
driving the need for systems that enable people to analyze
and understand data.

however, this opportunity to discover also presents chal-
lenges. reasoning about data is becoming more complicated
and diﬃcult as data scales and complexities increase. people
require powerful tools to draw valid conclusions from data,
while maintaining trustworthy and interpretable results.

we claim that visual analytics (va) and machine learn-
ing (ml) have complementing strengths and weaknesses
to address these challenges. visual analytics (va) is a
multi-disciplinary domain that combines data visualization
with machine learning (ml) and other automated tech-
niques to create systems that help people make sense of
data [tc05, ksf∗08, kei02, kmsz06]. over the years, much
work has been done to establish the foundations of this area,

submitted to computer graphics forum (6/2018).

create research advances in select topics, and form a com-
munity of researchers to continue to evolve the state of the
art.

currently, va techniques exist that make use of select
ml models or algorithms. however, there are additional
techniques that can apply to the broader visual data analysis
process. doing so reveals opportunities for how to couple user
tasks and activities with such models. similarly, opportunities
exist to advance ml models based on the cognitive tasks
invoked by interactive va techniques.

this state-of-the-art report brieﬂy summarizes the ad-
vances made at the intersection of ml and va. it describes
the extent to which machine learning methods are utilized in
visual analytics to date. further, it illuminates the opportuni-
ties within both disciplines that can drive important research
directions in the future. much of the content and inspiration
for this paper originated during a dagstuhl seminar titled,
“bridging machine learning with information visualization
(15101)” [kmrv15].

2

endert et al. / integrating machine learning into visual analytics

1.1. report organization

this report is organized as follows. section 2 of the report
discusses three categories of models: human reasoning, visual
analytics and information visualization, and machine learning.
the models describing the cognitive activity of sensemaking
and analytical reasoning characterize the processes that hu-
mans engage in cognitively to gain understanding of data.
the models and frameworks for visual analytics depict sys-
tematic descriptions of how computation and analytics can
be incorporated in the systematic construction and design
of visual analytic applications. finally, the machine learning
community has several models that illustrate how models
are trained, used, and interactively steered.

section 3 categorizes the integration of machine learning
techniques into visual analytic systems. section 4 discusses
how such systems have been used in speciﬁc domains to solve
real-world challenges. section 5 discusses a research direc-
tion for integrating steerable dimension reduction techniques
into visual analytics. finally, section 6 discusses open chal-
lenges and opportunities for ml and va. while the current
work shows how some progress has been made in bringing
these two communities closer together, there are several open
challenges.

2. models and frameworks

to ground the discussion of embedding ml techniques into
va systems for data analysis and knowledge discovery, we
describe three categories of models and frameworks below.
first, we discuss existing models meant to describe the cog-
nitive stages people progress through while analyzing data.
these models show the complex processes people go through
to gain insight from data, which developed systems must sup-
port. second, we discuss existing models and frameworks that
describe interaction and information design of visual analytic
applications. these models illustrate how data transforma-
tion and analytic computation are involved in generating the
visual representations of data in tools. user interaction is
critical in tuning and steering the parameters of these models.
finally, we show select ml frameworks that emphasize the
importance of training data and ground truth for generating
accurate and eﬀective computational models. in addition, we
describe the main techniques developed in the ml ﬁeld to
integrate user feedback in the training process.

2.1. models of sensemaking and knowledge

discovery

one should emphasize that a primary purpose of data analyt-
ics is for people to understand, and gain insights into, their
data [cms99,chr06]. thus, it is important to understand the
cognitive processes of people as they reason about data. it is
from such an understanding that “human-in-the-loop” appli-
cation designs are realized. prior work exists that provides
models and design guidelines for visual analytics.

sense-making is the process of “structuring the unknown”

figure 1: the “sensemaking loop” (from [pc05]) illustrating
the cognitive stages people go through to gain insight from
data.

by organising data into a framework that enables us “to
comprehend, understand, explain, attribute, extrapolate,
and predict” [anc12]. it is this activity of structuring–the
ﬁnding and assembly of data into meaningful explanatory
sequences [li57]–that enables us to turn ever more com-
plex observations of the world into ﬁndings we can under-
stand “explicitly in words and that serves as a springboard
into action” [wso05]. by attempting to articulate the un-
known, we are driven more by “plausibility rather than
accuracy” [wei95] as we create plausible explanations that
can be used to evolve and test our understanding of the
situation or the data. decision makers are often faced with
inaccurate representations of the world [ept∗05] and have
to ﬁll-in the gaps with strategies such as “story-telling” to
create stories that explain the situation.

one of the earliest models to describe the iterative process
of data analysis as “sensemaking” [rspc93] is presented
in figure 1 and illustrates the well-known (and probably
the most frequently cited) pirolli and card sensemaking
model [pc05]. proposed in the context of intelligence analysis,
it is useful for showing how information is handled through
the process of searching and retrieving relevant information,
organizing, indexing and storing the information for later use,
structuring the information to create a schema or a way to
explain what has been observed, the formulation and testing
of hypotheses, which then leads to the determination of a
conclusion, and a sharing of that conclusion. this notional
model depicts the cognitive stages of people as they use
visual analytic tools to gain understanding of their data.

from pirolli and card’s perspective, sensemaking can be
categorized into two primary phases: foraging and synthesis.
foraging refers to the stages of the process where models
ﬁlter and users gather collections of interesting or relevant
information. this phase emphasizes the computational ability
of models, as the datasets are typically much larger than
what a user can handle. then, using that foraged information,
users advance through the synthesis stages of the process,
where they construct and test hypotheses about how the

submitted to computer graphics forum (6/2018).

endert et al. / integrating machine learning into visual analytics

3

foraged information may relate to the larger plot. in contrast
to foraging, synthesis is more “cognitively intensive”, as much
of the insights stem from the user’s intuition and domain
expertise. most existing visualization tools focus on either
foraging or synthesis, separating these two phases.

as with all models of cognitive processes, there have been
criticisms. for instance, while there are feedback loops and
repeat loops, and cycles within cycles, it still is somewhat a
linear model. it describes the data transaction and informa-
tion handling and transformation processes, “... rather than
how analysts work and how they transition” [ks11]. human
analysts carry out their work within this framework, but
their thinking and reasoning processes are much less linear
and structured. for example, although recognised as a part
of the sense-making loop, there is little explanation about the
thinking and reasoning strategies that are invoked to formu-
late hypotheses. this is a critical aspect of the sense-making
process: how are explanations of the situation or data formed
in the mind of the human in order that the explanation can
be used to test one’s understanding of the data or situation?
later in this section, we report on work that is attempting
to unravel this aspect of how analysts think.

another useful model that can be employed to describe
the human-centered sense-making process is the “data-frame
model” by klein et al. [kmh06b, kmh06a]. their model
(figure 2) depicts an exchange of information between the
human and the data in terms of frames. people make sense of
a situation by interpreting the data they are presented with
in relation to what they already know to create a new under-
standing. a user has an internal “frame” that represents her
current understanding of the world. the data connects with
the frame. as she continues to explore a particular dataset,
her frames of the world are mapped against the information
she uncovers. if the information supports a speciﬁc frame,
that frame is thought to strengthen in a process they call
elaboration. as she understands the situation better, she
searches for more relevant information, learning that there
may be other factors to the problem than originally thought
or known, therefore driving the demand for more information,
and building her frame. however, when evidence is discovered
through exploration that contradicts or refutes the existence
of such a mental frame, the frame can either be augmented
or a new one created. this is the important process that
leads her to question her earlier conclusions or assumptions
made to arrive at these conclusions. additionally new frames
can also be created to reframe the problem. in situations
where data is missing or ambiguous or unknown, reframing
enables her to articulate the problem in diﬀerent ways that
may allow her to change her information search strategy
and perhaps even her goals. one of the key beneﬁts of the
data-frame model is that it points to the importance of de-
signing visual analytics in a way that encourages analysts to
question their data and their understanding, and to facilitate
visualizations and transformations that enable reframing of
their understanding of the situation.

recently a set of knowledge generation and synthesis mod-

submitted to computer graphics forum (6/2018).

figure
making [kmh06b].

2:

the data-frame model

of

sense-

els have been proposed that comprehensively attack a central
issue of visual analytics: developing a human-computer sys-
tem that enables analytic reasoning to produce actionable
knowledge. the ﬁrst of these models was proposed by sacha
et. al. [sss∗14] and is shown in figure 3. one sees looping
structures and components familiar from pirolli and card’s
sensemaking model, as depicted in figure 1 above. however,
the computer and human regions of the model, and their re-
lationship with each other, are now explicitly expressed, and
the paper shows a clear relationship, via interaction, between
the human and both the visualization and the model. the pa-
per also describes detailed steps for the data-visualization and
data-model pipelines (the latter in terms of kdd processes
that couple, for example, to machine learning algorithms).
whereas the sensemaking model was conceptual, this model
is concrete and shows, better than other models, where to put
computing and (via interactive interfaces) human-in-the-loop
steps in order to build an actual system.

the sacha et al. model has recently been generalized to
produce a more complete knowledge generation and synthesis
(kgs) model [rf16]. the kgs model explicityly accounts for
both prior knowledge (placed between data, visualization,
and model in figure 3) and user knowledge (placed between
action and finding). prior knowledge is quite important
for any exploration involving experts or based on expertise;
experts will want to know immediately the relationship of new
knowledge to existing domain knowledge. user knowledge
is built up during complex reasoning, where it can then
be the basis for generating additional knowledge or can be
synthesized with prior knowledge to produce more general
truths. the kgs model posits an iterative process that
addresses high level reasoning, such as inductive, deductive,
and abductive reasoning, in the knowledge generation and
exploration loops. it is based on a framework by gahegan
et al. [gwhr01] that was developed for giscience but is
generalizable.

these models provide a roadmap for visualization and
analytics processes, and for the role of human-computer in-
teraction. in particular, they illuminate the relationships
among machine learning, visualization, and analytics rea-

4

endert et al. / integrating machine learning into visual analytics

figure 3: human-computer knowledge generation model
of sacha et al. [sss∗14].

figure 4: the information visualization pipeline [hee06]
depicting the data transformation and visual mapping process
for constructing visualizations.

soning processes including exploration and knowledge gen-
eration. for example, klein’s data frame model, discussed
above, would ﬁt in this structure, providing a focus for ml
components while the models in figure 3 would show how
to connect the data frame model with interactive visualiza-
tion and hypothesis-building. there are no va systems that
embody all the components of the sacha and kgs models,
but there are some (e.g., vairoma [cdw∗16]) that include
parts of the model. typically in these systems, ml is a static
pre-processing step applied to the data at the beginning.
for example, in vairoma time-dependent, hierarchical topic
modeling is applied to large text collections [cdw∗16]. how-
ever, the kgs model shows how interactive ml can be placed
in the human-computer process and how it relates to interac-
tive visualization and reasoning. there is further discussion
of interactivity in vaml systems below. the discussion in
sacha et al. [sss∗14] implies two main roles for ml; one is to
transform unstructured or semi-structured data into a form
more meaningful for human exploration and insight discov-
ery. the other is to use unsupervised or semi-supervised ml
to guide the analysis itself by suggesting the best visualiza-
tions, sequences of steps in the exploration, veriﬁcation, or
knowledge generation processes, guarding against cognitive
bias, etc. in addition, since the kgs model was derived with
reference to cognitive science principles [grf09], there is a
possibility for merging ml with cognitive models to produce
even more powerful human-machine models. to illustrate,
one could explore fu and pirolli’s snif-act cognitive ar-
chitecture model [fp07], which connects human exploration
and information foraging in a sensemaking context. this
could be married with ml approaches to reﬁne and focus the
parameters of the ml approach for particular exploration
strategies.

2.2. models of interactivity in visual analytics

frameworks or pipelines for information visualization have
been previously developed [hee06, van05]. for example, the

information visualization pipeline depicted in figure 5 shows
how data characteristics are extracted and assigned visual
attributes or encodings, ultimately creating a visualization.
the designs of visualizations adhering to this pipeline exhibit
two primary components of the visual interface: the visualiza-
tion showing the information, and a graphical user interface
(gui) consisting of graphical controls or widgets. the graph-
ical controls in the gui (e.g., sliders, knobs, etc.) allow
users to directly manipulate the parameters they control. for
example, “direct manipulation” [shn83] user interfaces for
information visualizations enable users to directly augment
the values of data and visualization parameters to see the
corresponding change in the visualization (e.g., using a slider
to set the range of home prices and observing the ﬁltering
of results in a map showing homes for sale). this model
is a successful user interaction framework for information
visualizations.

visual analytic systems have adopted this method for user
interaction, but with the distinct diﬀerence of including ana-
lytic models or algorithms, as discussed earlier in this section.
for example, in addition to ﬁltering the data by selecting
ranges for home prices, users could be given graphical con-
trols over model parameters such as weighting the mixture
of eigenvectors of a principal component analysis (pca) di-
mension reduction (dr) model to produce two-dimensional
views showing pairwise similarity of homes across all of the
available dimensions. to users who lack expertise in such
models, this may pose fundamental usability challenges.

in contrast, prior work has proposed frameworks to per-
form model steering via machine learning techniques applied
to the user interactions performed during visual data analysis,
called semantic interaction [efn12b]. semantic interaction is
an approach to user interaction for visual data exploration in
which analytical reasoning of the user is inferred and in turn
used to steer the underlying models implicitly (illustrated in
figure 5). the goal of this approach to user interaction is
to enable co-reasoning between the human and the analytic
model (or models) used to create the visualization (coupling
cognition and computation) without requiring the user to
directly control the models.

the approach of semantic interaction is to overload the
visual metaphor through which the insights are obtained (i.e.,
the visualization of information created by computational
models) and the interaction metaphor through which hy-
potheses and assertions are communicated (i.e., interaction
occurs within the visual metaphor). semantic interaction
enables users to directly manipulate data within visualiza-
tions, from which tacit knowledge of the user is captured,
and the underlying analytic models are steered. the analytic
models can be incrementally adapted based on the user’s
sensemaking process and domain expertise explicated via
the user interactions with the system (as described in the
models of section 2.1).

the semantic interaction pipeline (shown in figure 5) takes
an approach of directly binding model steering techniques
to the interactive aﬀordances created by the visualization.

submitted to computer graphics forum (6/2018).

endert et al. / integrating machine learning into visual analytics

5

figure 5: the semantic interaction pipeline [efn12b] show-
ing how the user interactions in a spatial visualization can be
incorporated into the computation of a visual analytic system.

for example, a distance function used to determine the
relative similarity between two data points (often visually
depicted using distance in a spatial layout), can serve as
the interactive aﬀordance to allow users to explore that
relationship. therefore, the user interaction is directly in the
visual metaphor, creating a bi-directional medium between
the user and the analytic models [lhm∗11].

2.3. machine learning models and frameworks

there is not as much work in machine learning models and
frameworks. most of the proposals correspond to some form of
de facto industrial standards, such as the semma (sample,
explore, modify, model, and assess) methodology adver-
tised by sas institute inc. among those, a vendor neutral
framework, crisp-dm [she00], is somewhat comparable to
knowledge discovery and visual analytics frameworks. there
are six phases in the framework: business (or problem) un-
derstanding; data understanding (developed through explo-
ration of the data and discussion with data owners); data
preparation (including feature extraction, noise removal, and
transformation); modeling; evaluation (testing the quality of
the model, and particularly its generalization performance);
deployment (embedding the model in practice). in some
versions of this framework, there is an additional link from
deployment back to business understanding - this represents
the fact that the underlying data generator may change over
time. the model needs continuous evaluation in deployment
and when performance degrades, the process starts again.
perhaps more importantly, all the steps of the framework
are embedded in a general loop comparable to the ones ob-
served in other frameworks. this emphasize the feedback
from the latter stage of the process (evaluation in numerous
machine learning applications) to the early stages (e.g. data
preparation in crisp-dm).

as pointed out in e.g. [ackk14], the traditional imple-
mentation of the machine learning workﬂow leads to long
development cycles where end users (who are also domain
experts) are asked to give feedback on the modeling results.
this feedback is used by machine learning experts to tune the
whole processing chain, especially at the data preparation
stage. ideally, this feedback should take the form of speciﬁc
and formal user inputs, for example positive and negative
feedback on exemplars (such as “those two objects should not
belong to the same cluster” or “this object is misclassiﬁed”).

user feedback in this formal, expressive form lends it-
self very well to steering and training machine learning
models, for example via interactive machine learning ap-

submitted to computer graphics forum (6/2018).

proaches [pth13]. figure 6 shows an early model of inter-
active machine learning that emphasizes the feedback that
users give to train classiﬁers [foj03]. through multiple iter-
ations of feedback, the classiﬁer gets more training examples,
and is thus able to more closely approximate the phenomena
or concept being classiﬁed in the data.

to further establish an ml framework, we note the follow-
ing. machine learning tasks are traditionally divided into two
broad categories, supervised tasks and unsupervised tasks.
in supervised learning, the goal is to construct a model that
maps an input to an output, using a set of examples of
this mapping, the training set. the quality of the model is
evaluated via a ﬁxed loss criterion. up till recently, it has
generally been considered that human input is not needed in
the model construction phase. on the contrary, it could lead
to undetected overﬁtting. indeed the expected quality of the
model on future data (its so-called generalization ability) is
generally estimated via an independent set of examples, the
test set. allowing the user (or a program) to tune the model
using this set will generally reduce the generalization ability
of the model and prevent any sound evaluation of this ability
(unless yet another set of examples is available).

supervision via examples can be seen as a direct form of
user control over the training process. allowing the user to
modify the training set interactively provides an indirect way
of integrating user inputs into the model construction phase.
in addition, opportunities for user feedback and control are
available before and after this modeling step (e.g., using
the crisp-dm phases). for instance, user feedback can be
utilized at the feature selection, error preferences, and other
steps. leveraging those opportunities (including training
set modiﬁcation) has been the main focus of interactive
machine learning approaches. for instance, tools such as the
crayons system from [foj03] allow the user to add new
training data by specifying in a visual way positive and
negative examples. this speciﬁc type of user feedback in the
