index,pdf_file,text,topics,year,author,clusterID,citations,type,abstract,globalID,tags,user,words,pages,abstract_bert_vector,citationsList,versions,url,notes,title,bert_vector,parent_item,conclusion_bert_vector,organization,citationArticles,vec_2d,abstract_2d,conclusion_2d
t. a.: the science of interaction. information visualization 8,
4 (2009), 263–274. 16, 18

[pspm15] paiva j. g. s., schwartz w. r., pedrini h.,
minghim r.: an approach to supporting incremental visual
data classiﬁcation. visualization and computer graphics, ieee
transactions on 21, 1 (2015), 4–17. 8, 12

[pth13] porter r., theiler j., hush d.: interactive ma-

submitted to computer graphics forum (6/2018).

chine learning in data exploitation. computing in sci-
ence and engineering 15, 5 (2013), 12–20. doi:http://doi.
ieeecomputersociety.org/10.1109/mcse.2013.74. 5

[ptrv13] parulek j., turkay c., reuter n., viola i.: vi-
sual cavity analysis in molecular simulations. bmc bioinfor-
matics 14, 19 (2013), 1–15. 8, 9

[pzs∗15] p´erez d., zhang l., schaefer m., schreck t.,
keim d., d´ıaz i.: interactive feature space extension for multi-
dimensional data projection. neurocomputing 150, part (2015),
611–626.
url: http://www.sciencedirect.com/science/
article/pii/s0925231214012879, doi:http://dx.doi.org/10.
1016/j.neucom.2014.09.061. 8, 17

[rawc14] rooney c., attfield s., wong b. w., choudhury
s.: invisque as a tool for intelligence analysis: the construction
of explanatory narratives. international journal of human-
computer interaction 30, 9 (2014), 703–717. 19

[recc10] rose s., engel d., cramer n., cowley w.: au-
tomatic keyword extraction from individual documents. john
wiley & sons, ltd, pp. 1–20. doi:10.1002/9780470689646.ch1.
12

[rf16] ribarsky w., fisher b.: the human-computer system:
towards an operational model for problem-solving. in hawaii
international conference on systems science (hicss 2016)
(2016). 3, 17

[rk04] rasmussen m., karypis g.: gcluto–an interactive
clustering, visualization, and analysis system., university of
minnesota, department of computer science and engineering,
cse. tech. rep., umn technical report: tr, 2004. 8

[rpn∗08] rinzivillo s., pedreschi d., nanni m., giannotti
f., andrienko n., andrienko g.: visually driven analy-
sis of movement data by progressive clustering. information
visualization 7, 3 (2008), 225–239. 8, 9

[rse09] rudolph s., savikhin a., ebert d. s.: finvis: ap-
plied visual analytics for personal ﬁnancial planning. in visual
analytics science and technology, 2009. vast 2009. ieee
symposium on (2009), ieee, pp. 195–202. 14

[rspc93] russell d. m., stefik m. j., pirolli p., card
s. k.: the cost structure of sensemaking. in proceedings of the
interact’93 and chi’93 conference on human factors in
computing systems (1993), acm, pp. 269–276. 2

[sbtk08]

schreck t., bernard j., tekusova t., kohlham-
mer j.: visual cluster analysis of trajectory data with interac-
tive kohonen maps. in ieee symposium on visual analytics
science and technology, 2008. vast’08 (2008), pp. 3–10. 8, 9

[sdlc93]

spiegelhalter d. j., dawid a. p., lauritzen s. l.,
cowell r. g.: bayesian analysis in expert systems. statistical
science (1993), 219–247. 22

[sdmt16]

stahnke j., dork m., muller b., thom a.: prob-
ing projections: interaction techniques for interpreting arrange-
ments and errors of dimensionality reductions. visualization
and computer graphics, ieee transactions on 22, 1 (2016),
629–638. 8

[set09]

settles b.: active learning literature survey. com-
puter sciences technical report 1648, university of wisconsin–
madison, 2009. 5, 8, 12

[sgg∗14]

streit m., gratzl s., gillhofer m., mayr a.,
mitterecker a., hochreiter s.: furby: fuzzy force-directed
bicluster visualization. bmc bioinformatics 15, suppl 6 (2014),
s4. 8, 16

[sgl08]

stasko j., goerg c., liu z.: jigsaw: supporting
investigative analysis through interactive visualization.
in-
formation visualization 7 (2008), 118–132. 2. doi:10.1145/
1466620.1466622. 13

endert et al. / integrating machine learning into visual analytics

28
[sha∗01]

shipman f., hsieh h., airhart r., maloor p.,
moore j. m., shah d.: emergent structure in analytic
workspaces: design and use of the visual knowledge builder.
pp. 132–139. 12

[she00]

shearer c.: the crisp-dm model: the new blueprint for
data mining. journal of data warehousing 5, 4 (2000), 13–22. 5
shneiderman b.: direct manipulation: a step beyond
programming languages. computer 16, 8 (1983), 57–69. doi:
10.1109/mc.1983.1654471. 4, 7

[shn83]

[sk10]

strumbelj e., kononenko i.:

an eﬃcient ex-
planation of
individual classiﬁcations using game theory.
journal of machine learning research 11 (2010), 1–18.
url: http://doi.acm.org/10.1145/1756006.1756007, doi:
10.1145/1756006.1756007. 8, 9

[sku02]

skupin a.: a cartographic approach to visualizing
conference abstracts. ieee computer graphics and applica-
tions 22 (2002), 50–58. doi:10.1109/38.974518. 12, 16

[sm99]

shipman f., marshall c.: formality considered harm-
ful: experiences, emerging themes, and directions on the use
of formal representations in interactive systems. comput.
supported coop. work 8 (1999), 333–352. 4. doi:10.1023/a:
1008716330212. 12

[smnr16]

sun m., mi p., north c., ramakrishnan n.: biset:
semantic edge bundling with biclusters for sensemaking. ieee
transactions on visualization and computer graphics 22, 1
(2016), 310–319. 16

[snr14]

sun m., north c., ramakrishnan n.: a ﬁve-level
design framework for bicluster visualizations. ieee transactions
on visualization and computer graphics 20, 12 (2014), 1713–1722.
16

[spg14]

stolper c. d., perer a., gotz d.: progressive visual
analytics: user-driven visual exploration of in-progress analytics.
visualization and computer graphics, ieee transactions on
20, 12 (2014), 1653–1662. 20

[ss02]

seo j., shneiderman b.: interactively exploring hierar-
chical clustering results. ieee computer 35, 7 (2002), 80–86.
8

[ss11]

satinover j., sornette d.: taming manias: on the
origins, inevitability, prediction and regulation of bubbles and
crashes, chapter of the book “governance and control of ﬁnan-
cial systems: a resilience engineering perspective,”. published
by ashgate publishing group in their resilience engineering
perspectives series (2011). 19

[sss∗14]

sacha d., stoffel a., stoffel f., kwon b. c.,
ellis g., keim d. a.: knowledge generation model for vi-
sual analytics. visualization and computer graphics, ieee
transactions on 20, 12 (2014), 1604–1613. 3, 4

[swb97]

sarter n. b., woods d. d., billings c. e.: au-
tomation surprises. handbook of human factors and ergonomics
2 (1997), 1926–1943. 19

[szs∗16]

sacha d., zhang l., sedlmair m., lee j. a., pel-
tonen j., weiskopf d., north s. c., keim d. a.: visual
interaction with dimensionality reduction: a structured liter-
ature analysis. ieee trans. on visualization and computer
graphics (2016). 6

[tc05] thomas j. j., cook k. a.: illuminating the path: the
research and development agenda for visual analytics. ieee
computer society press, 2005. 1

[tfh11] turkay c., filzmoser p., hauser h.: brushing
dimensions-a dual visual analysis model for high-dimensional
data. visualization and computer graphics, ieee transac-
tions on 17, 12 (2011), 2591–2599. 8

[tjhh14] turkay c., jeanquartier f., holzinger a.,
hauser h.: on computationally-enhanced visual analysis of

heterogeneous data and its application in biomedical informat-
ics. in interactive knowledge discovery and data mining in
biomedical informatics. springer, 2014, pp. 117–140. 6

[tkbh17] turkay c., kaya e., balcisoy s., hauser h.:
designing progressive and interactive analytics processes for
high-dimensional data analysis. ieee transactions on visual-
ization & computer graphics 23, 1 (2017), 131–140. 20

[tllh12] turkay c., lundervold a., lundervold a.,
hauser h.: representative factor generation for the inter-
active visual analysis of high-dimensional data. visualization
and computer graphics, ieee transactions on 18, 12 (2012),
2621–2630. 8, 10

[tls∗14] turkay c., lex a., streit m., pfister h., hauser
h.: characterizing cancer subtypes using dual analysis in
caleydo stratomex. ieee computer graphics and applications
34, 2 (2014), 38–47. doi:http://doi.ieeecomputersociety.
org/10.1109/mcg.2014.1. 8, 9, 10

[tprh11a] turkay c., parulek j., reuter n., hauser h.:
integrating cluster formation and cluster evaluation in inter-
active visual analysis. in proceedings of the 27th spring con-
ference on computer graphics (2011), acm, pp. 77–86. 8,
9

[tprh11b] turkay c., parulek j., reuter n., hauser
h.:
interactive visual analysis of temporal cluster struc-
tures. computer graphics forum 30, 3 (2011), 711–720. url:
http://dx.doi.org/10.1111/j.1467-8659.2011.01920.x. 8, 9
[van05] van wijk j. j.: the value of visualization. in 16th
ieee visualization 2005 (vis 2005) (2005), ieee computer
society, p. 11. doi:10.1109/vis.2005.102. 4, 16

[vdevw11]

van den elzen s., van wijk j. j.: baobabview:
interactive construction and analysis of decision trees. in vi-
sual analytics science and technology (vast), 2011 ieee
conference on (2011), ieee, pp. 151–160. 8, 9

[vdmw12]

van der maaten l., weinberger k.: stochastic
triplet embedding. in 2012 ieee international workshop on
machine learning for signal processing (sept 2012), pp. 1–6.
doi:10.1109/mlsp.2012.6349720. 6

[ves99] vesanto j.: som-based data visualization methods.
intelligent data analysis 3, 2 (1999), 111–126. doi:10.3233/
ida-1999-3203. 16

[vl13] verleysen m., lee j. a.: nonlinear dimensionality
reduction for visualization. in neural information processing
(2013), springer, pp. 617–622. 16

[wei95] weick k. e.: sensemaking in organizations, vol. 3.

sage, 1995. 2

[wh00] wirth r., hipp j.: crisp-dm: towards a standard
process model for data mining. in proceedings of the 4th inter-
national conference on the practical applications of knowledge
discovery and data mining (2000), citeseer, pp. 29–39. 22

[wkkb15] wilber m. j., kwak i. s., kriegman d., be-
longie s.: learning concept embeddings with combined
human-machine expertise. in 2015 ieee international con-
ference on computer vision (iccv) (dec 2015), pp. 981–989.
doi:10.1109/iccv.2015.118. 6

[wls∗10] wei f., liu s., song y., pan s., zhou m. x., qian
w., shi l., tan l., zhang q.: tiara: a visual exploratory text
analytic system. in proceedings of the 16th acm sigkdd in-
ternational conference on knowledge discovery and data mining
(2010), acm, pp. 153–162. 13

[wm04] williams m., munzner t.: steerable, progressive mul-
tidimensional scaling. in proceedings of the ieee symposium
on information visualization (washington, dc, usa, 2004),
ieee computer society, pp. 57–64. 8

submitted to computer graphics forum (6/2018).

endert et al. / integrating machine learning into visual analytics

29

[won14] wong b.: how analysts think (?): early observations.
in intelligence and security informatics conference (jisic),
2014 ieee joint (2014), ieee, pp. 296–299. 19

[wso05] weick k. e., sutcliffe k. m., obstfeld d.: orga-
nizing and the process of sensemaking. organization science
16, 4 (2005), 409–421. 2

[wsp∗06] wright w., schroh d., proulx p., skaburskis
a., cort b.: the sandbox for analysis: concepts and methods.
acm, pp. 801–810. doi:10.1145/1124772.1124890. 13

[wtp∗99] wise j. a., thomas j. j., pennock k., lantrip
d., pottier m., schur a., crow v.: visualizing the non-
visual: spatial analysis and interaction with information for text
documents. morgan kaufmann publishers inc., pp. 442–450. 8,
12, 13

[wv12] wong b. w., varga m.: black holes, keyholes and
brown worms: challenges in sense making. in proceedings of
the human factors and ergonomics society annual meeting
(2012), vol. 56, sage publications, pp. 287–291. 19

[yaksj07] yi j. s., ah kang y., stasko j. t., jacko j. a.:
toward a deeper understanding of the role of interaction in in-
formation visualization. visualization and computer graphics,
ieee transactions on 13, 6 (2007), 1224–1231. 7

[ykj16] yeon h., kim s., jang y.: predictive visual ana-
lytics of event evolution for user-created context. journal of
visualization (2016), 1–16. 8, 15

[ynm∗13] younesy h., nielsen c. b., m¨oller t., alder o.,
cullum r., lorincz m. c., karimi m. m., jones s. j.: an
interactive analysis and exploration tool for epigenomic data.
in computer graphics forum (2013), vol. 32, wiley online
library, pp. 91–100. 8, 15

[zc07] zhu w., chen c.: storylines: visual exploration and
analysis in latent semantic spaces. computers & graphics 31,
3 (2007), 338–349. 13, 14

[zjgk10] ziegler h., jenny m., gruse t., keim d. a.: vi-
sual market sector analysis for ﬁnancial time series data. in
visual analytics science and technology (vast), 2010 ieee
symposium on (2010), ieee, pp. 83–90. 14, 15

[znk08] ziegler h., nietzschmann t., keim d. a.: visual
analytics on the ﬁnancial market: pixel-based analysis and
comparison of long-term investments. in information visualisa-
tion, 2008. iv’08. 12th international conference (2008), ieee,
pp. 287–295. 14

submitted to computer graphics forum (6/2018).

